"","name","variable","Nigeria","Congo","Georgia","Paraguay","Guyana","Algeria","Bangladesh","CAR","Chad","DRC","Guinea Bissau","Gambia","Ghana","Iraq","Kiribati","Kosovo","LaoPDR","Lesotho","Madagascar","Mongolia","Nepal","PakistanPunjab","PakistanSindh","Sao Tome and Principe","SierraLeone","Suriname","Tonga","Togo","Tunisia","Zimbabwe","DominicanRepublic"
"1","EU1","type of stove",NA,"Type de cuisinière utilisé principalement pour faire le ménage","Type of cookstove mainly used for cooking",NA,"Type of cookstove mainly used for cooking","Dans votre ménage, quel type de cuisinière utilisez-vous principalement pour faire la cuisine?","Type of cookstove mainly used for cooking","Type de cuisinière principalement utilisée pour le cuisson","Type de cuisinière principale","Type de cuisinière utilisé principalement pour faire le ménage","Que tipo de fogão utilizam no vosso AF principalmente para cozinhar?","Type of cookstove mainly used for cooking","Type of cookstove mainly used for cooking","Type of cookstove mainly used for cooking","Type of cookstove mainly used for cooking","Type of cookstove mainly used for cooking","Type of cookstove mainly used for cooking",NA,"Type de cuisinière principale","Type of cookstove mainly used for cooking","Type of cookstove mainly used for cooking","Type of cookstove mainly used for cooking","Type of cookstove mainly used for cooking","Tipo de fogão usado principalmente para cozinhar","Type of cookstove mainly used for cooking","Type of cookstove mainly used for cooking","Type of cookstove mainly used for cooking","Type de cuisinière principale","Type of cookstove mainly used for cooking","Type of cookstove mainly used for cooking","¿Qué tipo de estufa emplea principalmente en su hogar para cocinar?"
"2","EU2","Cookstove have a chimney",NA,NA,"Cookstove have a chimney",NA,"Cookstove have a chimney","Est-ce qu'elle a une cheminée","Cookstove have a chimney","La cuisine a une cheminée","Cuisinière a une cheminée",NA,"A cozinha dispõem de uma chaminé?","Cookstove have a chimney","Cookstove have a chimney","Cookstove have a chimney","Cookstove have a chimney","Cookstove has a chimney","Cookstove have a chimney",NA,"Cuisinière a une cheminée",NA,"Cookstove have a chimney","Cookstove have a chimney","Cookstove have a chimney","Tem uma chaminé","Cookstove have a chimney","Cookstove have a chimney","Cookstove have a chimney","Cuisinière a une cheminée","Cookstove have a chimney","Cookstove have a chimney",NA
"3","EU3","Cookstove have a fan",NA,"La cuisinière a un ventilateur",NA,NA,"Cookstove have a fan","Est-ce qu'il y a un ventilateur","Cookstove have a fan","La cuisine a un ventilateur","Cuisinière a un ventilateur","La cuisinière a un ventilateur","A cozinha dispõe de um ventilador?","Cookstove have a fan","Cookstove have a fan","Cookstove have a fan","Cookstove have a fan","Cookstove has a fan","Cookstove have a fan",NA,"Cuisinière a un ventilateur",NA,"Cookstove have a fan","Cookstove have a fan","Cookstove have a fan","Tem um ventilador/Exaustor","Cookstove have a fan","Cookstove have a fan","Cookstove have a fan","Cuisinière a un ventilateur","Cookstove have a fan","Cookstove have a fan",NA
"4","EU4","Type of energy source for cookstove","Type of fuel using for cooking","Type d'énergie utilisée pour la cuisinière","Type of energy source for cookstove","Tipo de combustible utilizado principalmente en su hogar para cocinar","Type of energy source for cookstove","Quel type de carburant ou énergie est utilisé dans cette cuisinière","Type of energy source for cookstove","Type de combustible ou de source d’énergie pour la cuisson","Source d'énergie de la cuisinière","Type d'énergie utilisée pour la cuisinière","Que tipo de combustível ou fonte de energia e utilizado nesta cozinha?","Type of energy source for cookstove","Type of energy source for cookstove","Type of energy source for cookstove","Type of energy source for cookstove","Type of energy source for cookstove","Type of energy source for cookstove",NA,"Source d'énergie de la cuisinière","Type of energy source for cookstove","Type of energy source for cookstove","Type of energy source for cookstove","Type of energy source for cookstove","Tipo de fonte de energia para o fogão","Type of energy source for cookstove","Type of energy source for cookstove","Type of energy source for cookstove","Source d'énergie de la cuisinière","Type of energy source for cookstove","Type of energy source for cookstove","¿Cuál es el principal combustible que se utiliza en este hogar para cocinar?"
"5","HC17","Household own any animals",NA,"Le ménage possède-t-il des du bétail,des troupeaux et d'autres animaux de ferme ou de la volaille","Household own any animals",NA,"Household own any animals","Est-ce que ce ménage posséde du bétail, des troupeaux, d'autres animaux de ferme ou de la volaille","Household own any animals","Le ménage possède des animaux","Le ménage a des animaux","Le ménage possède-t-il des du bétail,des troupeaux et d'autres animaux de ferme ou de la volaille","Este agregado possui gado bovino, caprino ou outros animais e aves","Household own any animals","Household own any animals","Household own any animals","Household own any animals","Household own any animals","Household own any animals","Household own any animals","Le ménage a des animaux","Household own any animals","Household own any animals","Household own any animals","Household own any animals","Agregado possui aminais","Household own any animals","Household own any animals","Household own any animals","Le ménage a des animaux","Household own any animals","Household own any animals or poultry","¿Posee algún miembro del hogar ganado, rebaño u otros animales de granja o aves de corral?"
"6","HC4","Main material of floor","Main material of floor","Matériau principal du sol du logement","Main material of floor","Material predominante del piso de la vivienda","Main material of floor","Matériau principal du sol","Main material of floor","Matériau principal du sol","Matériau principal du sol","Matériau principal du sol du logement","Qual é o material predominante no piso/chão do alojamento?","Main material of floor","Main material of floor","Main material of floor","Main material of floor","Main material of floor","Main material of floor","Main material of floor","Matériau principal du sol","Main material of floor","Main material of floor","Main material of floor","Main material of floor","Material principal do chão","Main material of floor","Main material of floor","Main material of floor","Matériau principal du sol","Main material of floor","Main material of floor","Material predominante del piso de esta vivienda."
"7","HC5","Main material of roof","Main material of roof","Matériau principal du toit","Main material of roof","Material principal del techo","Main material of roof","Matériau principal du toit","Main material of roof","Matériau principal du toit","Matériau principal du toit","Matériau principal du toit","Material predominante na cobertura do alojamento?","Main material of roof","Main material of roof","Main material of roof","Main material of roof","Main material of roof","Main material of roof","Main material of roof","Matériau principal du toit","Main material of roof","Main material of roof","Main material of roof","Main material of roof","Material principal do telhado","Main material of roof","Main material of roof","Main material of roof","Matériau principal du toit","Main material of roof","Main material of roof","Material predominante del techo de esta vivienda."
"8","HC6","Main material of exterior wall","Main material of exterior wall","Matériau principal des murs extérieurs","Main material of exterior wall","Material principal de las paredes exteriores","Main material of exterior wall","Matériau principal des murs extérieurs","Main material of exterior wall","Matériau principal des murs extérieurs","Matériau principal des murs extérieurs","Matériau principal des murs extérieurs","Material predominante nas paredes externas.","Main material of exterior wall","Main material of exterior wall","Main material of exterior wall","Main material of exterior wall","Main material of exterior wall","Main material of exterior wall","Main material of exterior wall","Matériau principal des murs extérieurs","Main material of exterior wall","Main material of exterior wall","Main material of exterior wall","Main material of exterior wall","Material principal da parede exterior","Main material of exterior wall","Main material of exterior wall","Main material of exterior wall","Matériau principal des murs extérieurs","Main material of exterior wall","Main material of exterior wall","Material predominante de las paredes exteriores."
"9","HW1","Place where household members most often wash their hands","Place where household members most often wash their hands","L'endroit où les membres du ménage se lavent habituellement les mains","Place where household members most often wash their hands","Puede mostrarme qué lugar usan con mayor frecuencia los miembros del hogar para lavarse las manos?","Place where household members most often wash their hands","Nous aimerions savoir où les membres de ce ménage se lavent les mains.","Place where household members most often wash their hands","Lieu où les membres du ménage se lavent les mains la plupart du temps","Lieu où les membres du ménage se lavent les mains la plupart du temps","L'endroit où les membres du ménage se lavent habituellement les mains","Gostaríamos de saber onde os membros deste AF lavam as mãos.","Place where household members most often wash their hands","Place where household members most often wash their hands","Place where household members most often wash their hands","Place where household members most often wash their hands",NA,"Place where household members most often wash their hands","Place where household members most often wash their hands","Lieu où les membres du ménage se lavent les mains la plupart du temps","Place where household members most often wash their hands","Place where household members most often wash their hands","Place where household members most often wash their hands","Place where household members most often wash their hands","Lugar onde os membros da casa costumam lavar as mãos","Place where household members most often wash their hands","Place where household members most often wash their hands","Place where household members most often wash their hands","Lieu où les membres du ménage se lavent les mains la plupart du temps","Place where household members most often wash their hands","Place where household members most often wash their hands","Nos gustaría conocer sobre los lugares que utilizan los miembros del hogar para lavarse las manos."
"10","HW2","Water available at the place for handwashing","Water available at the place for handwashing","Présence d'eau au lieu de lavage des mains","Water available at the place for handwashing","Observe si hay agua en el lugar especifico para el lavado de manos","Water available at the place for handwashing","Observer la présence d'eau au lieu de lavage des mains","Water available at the place for handwashing","L'eau disponible au lieu spécifique de lavage des mains","De l'eau a été vue au lieu spécifique de lavage des mains","Présence d'eau au lieu de lavage des mains","Observar se existe a água no local específico para a lavagem das mãos","Water available at the place for handwashing","Water available at the place for handwashing","Water available at the place for handwashing","Water available at the place for handwashing",NA,"Water available at the place for handwashing","Water available at the place for handwashing","De l'eau a été vue au lieu spécifique de lavage des mains","Water available at the place for handwashing","Water available at the place for handwashing","Water available at the place for handwashing","Water available at the place for handwashing","Água disponível no local para lavar as mãos","Water available at the place for handwashing","Water available at the place for handwashing","Water available at the place for handwashing","De l'eau a été vue au lieu spécifique de lavage des mains","Water available at the place for handwashing","Water available at the place for handwashing","Observe si hay agua en el lugar específico para el lavado de manos."
"11","HW3","Soap or detergent present at place of handwashing",NA,"Savon ou détergent présent à l'endoit de lavage des mains","Soap or detergent present at place of handwashing",NA,"Soap or detergent present at place of handwashing","Y a-t-il du savon, de la lessive ou d'autres produits nettoyant sur le lieu de lavage des mains","Soap or detergent present at place of handwashing","Savon ou détergent présent au lieu de lavage des mains","Savon ou autres produits nettoyants sont observés au lieu spécifique de lavage des mains","Savon ou détergent présent à l'endoit de lavage des mains","Há sabão detergente ou cinza, lama, areia presentes no lugar de lavagem das mãos ?","Soap or detergent present at place of handwashing","Soap or detergent present at place of handwashing","Soap or detergent present at place of handwashing","Soap or detergent present at place of handwashing",NA,"Soap or detergent present at place of handwashing","Soap or detergent present at place of handwashing","Savon ou autres produits nettoyants sont observés au lieu spécifique de lavage des mains","Soap or detergent present at place of handwashing","Soap or detergent present at place of handwashing","Soap or detergent present at place of handwashing","Soap or detergent present at place of handwashing","Sabão ou detergente presente no local de lavagem das mãos","Soap or detergent present at place of handwashing","Soap or detergent present at place of handwashing","Soap or detergent present at place of handwashing","Savon ou autres produits nettoyants sont observés au lieu spécifique de lavage des mains","Soap or detergent present at place of handwashing","Soap or detergent present at place of handwashing","¿Hay jabón o detergente en el lugar específico para el lavado de manos?"
"12","HW4","Usual place for handwashing","Soap/other material available for washing hands","Endoit habituel pour le lavage des mains","Usual place for handwashing","Tiene algún jabón o detergente  o ceniza/barro/arena en el hogar para lavarse las manos?","Usual place for handwashing","Où est-ce que vous ou les autres membres de votre ménage vous lavez-vous le plus souvent les mains","Usual place for handwashing","Endroit habituel pour se laver les mains","Lieu habituel de lavage des mains","Endoit habituel pour le lavage des mains","Onde é que o/a Senhor (a) e os outros membros do vosso AF lavam sempre as mãos?","Usual place for handwashing","Usual place for handwashing","Usual place for handwashing","Usual place for handwashing",NA,"Usual place for handwashing","Usual place for handwashing","Lieu habituel de lavage des mains","Usual place for handwashing","Usual place for handwashing","Usual place for handwashing","Usual place for handwashing","Lugar usual para lavar as mãos","Usual place for handwashing","Usual place for handwashing","Usual place for handwashing","Lieu habituel de lavage des mains","Usual place for handwashing","Usual place for handwashing","¿Usualmente dónde se lavan las manos usted y los demás miembros del hogar?"
"13","HW5","Soap/other material available for washing hands",NA,"Savon / autre matériel disponible pour le lavage des mains","Soap/other material available for washing hands",NA,"Soap/other material available for washing hands","Avez-vous du savon, de la lessive ou d'autres produits nettoyant dans votre maison pour vous laver les mains","Soap/other material available for washing hands","Savon/autre matériau disponible pour se laver les mains","Savon ou autres produits nettoyants disponibles","Savon / autre matériel disponible pour le lavage des mains","Há sabão, lixivia, detergente ou cinza, lama, areia presentes no vosso alojamento para lavar as mãos?","Soap/other material available for washing hands","Soap/other material available for washing hands","Soap/other material available for washing hands","Soap/other material available for washing hands",NA,"Soap / other material available for washing hands","Soap/other material available for washing hands","Savon ou autres produits nettoyants disponibles","Soap/other material available for washing hands","Soap/other material available for washing hands","Soap or detergent available for washing hands","Soap or detergent available for washing hands","Sabão / outro material disponível para lavar as mãos","Soap/other material available for washing hands","Soap/other material available for washing hands","Soap, ash/sand/leaves or other material available for washing hands","Savon ou autres produits nettoyants disponibles","Soap/other material available for washing hands","Soap/other material available for washing hands","¿Hay jabón en barra, líquido o en polvo su hogar para lavarse las manos?"
"14","HW6","Hand washing material shown",NA,"Matériel de lavage des mains observé","Hand washing material shown",NA,"Hand washing material shown","Matériel de lavage des mains montré","Hand washing material shown","Matériel de lavage des mains montré","Savon ou autres produits nettoyants montrés","Matériel de lavage des mains observé","Pode mostrar-me por favor?","Hand washing material shown","Hand washing material shown","Hand washing material shown","Hand washing material shown",NA,"Hand washing material shown","Hand washing material shown","Savon ou autres produits nettoyants montrés","Hand washing material shown","Hand washing material shown","Hand washing material shown","Hand washing material shown","Material de lavagem das mãos mostrado","Hand washing material shown","Hand washing material shown","Hand washing material shown","Savon ou autres produits nettoyants montrés","Hand washing material shown","Hand washing material shown","¿Podría mostrármelo, por favor?"
"15","WQ14","Drink water without making any treatment","Blank water tested","Quelque chose esty faite à l""eau pour la rendre plus saine à boire","Done anything to the water to make it safer to drink","Realice el ensayo en blanco del agua","Done anything to the water to make it safer to drink","Faites-vous quelque chose à l'eau pour la rendre buvable","Done anything to the water to make it safer to drink","Faire quelque chose à l'eau pour la rendre plus saine à boire","Traite l'eau pour la rendre propre à la boisson","Quelque chose esty faite à l""eau pour la rendre plus saine à boire","Você ou outro membro do AF fez alguma coisa para tornar esta água que me deu potável para beber?","Done anything to the water to make it safer to drink","Done anything to the water to make it safer to drink","Done anything to the water to make it safer to drink","Done anything to the water to make it safer to drink","Done anything to the water to make it safer to drink","Done anything to the water to make it safer to drink","Done anything to the water to make it safer to drink","Traite l'eau pour la rendre propre à la boisson","Drink water without making any treatment","Done anything to the water to make it safer to drink","Done anything to the water to make it safer to drink","Done anything to the water to make it safer to drink","Feito qualquer coisa para a água para torná-lo mais seguro para beber","Done anything to the water to make it safer to drink","Done anything to the water to make it safer to drink","Done anything to the water to make it safer to drink","Traite l'eau pour la rendre propre à la boisson","Done anything to the water to make it safer to drink","Done anything to the water to make it safer to drink","¿Ha hecho usted o algún miembro de este hogar algo con esta agua para hacerla más segura para beber?"
"16","WQ15A","Water treatment: Boil",NA,"Traitement de l'eau: Bouillir","Water treatment: Boil",NA,"Water treatment: Boil","Traitement de l'eau: LA FAIRE BOUILLIR","Water treatment: Boil","Traitement de l'eau : Bouillir","Traitement de l'eau: La faire bouillir","Traitement de l'eau: Bouillir","Tratamento de agua: Ferve-a","Water treatment: Boil","Water treatment: Boil","Water treatment: Boil","Water treatment: Boil","Water treatment: Boil","Water treatment: Boil","Water treatment: Boil","Traitement de l'eau: La faire bouillir","Water treatment: Boil","Water treatment: Boil","Water treatment: Boil","Water treatment: Boil","Tratamento de água: Ferver","Water treatment: Boil","Water treatment: Boil","Water treatment: Boil","Traitement de l'eau: La faire bouillir","Water treatment: Boil","Water treatment: Boil","Tratamiento de agua: LA HIERVEN"
"17","WQ15B","Water treatment: Add bleach/chlorine",NA,"Traitement de l'eau: Ajouter de la Javel/Chlore","Water treatment: Add bleach/chlorine",NA,"Water treatment: Add bleach/chlorine","Traitement de l'eau: AJOUTER DE LA JAVEL/CHLORE","Water treatment: Add bleach/chlorine","Traitement de l'eau : Ajouter de la javel/chlore","Traitement de l'eau: Ajouter de la javel/ chlore","Traitement de l'eau: Ajouter de la Javel/Chlore","Tratamento de agua: Adicionar lixivia ou pastilha de cloro","Water treatment: Add bleach/chlorine","Water treatment: Add bleach/chlorine","Water treatment: Add bleach/chlorine","Water treatment: Add bleach/chlorine","Water treatment: Add bleach/chlorine","Water treatment: Add bleach / chlorine","Water treatment: Add bleach/chlorine","Traitement de l'eau: Ajouter de la javel/ chlore","Water treatment: Add bleach/chlorine","Water treatment: Add bleach/chlorine","Water treatment: Add bleach/chlorine","Water treatment: Add bleach/chlorine","Tratamento de água: Adicionar lixivia / cloro","Water treatment: Add bleach/chlorine","Water treatment: Add bleach/chlorine","Water treatment: Add bleach/chlorine","Traitement de l'eau: Ajouter de la javel/ chlore","Water treatment: Add bleach/chlorine","Water treatment: Add bleach/chlorine","Tratamiento de agua: LE AÑADEN CLORO O BLANQUEADOR"
"18","WQ15C","Water treatment: Strain it through a cloth",NA,"Traitement de l'eau: Fioltrer à travers un tissu","Water treatment: Strain it through a cloth",NA,"Water treatment: Strain it through a cloth","Traitement de l'eau: LA FILTRER A TRAVERS UN TISSU","Water treatment: Strain it through a cloth","Traitement de l'eau : Filtrer à travers un tissu","Traitement de l'eau: La filtrer a travers un tissu","Traitement de l'eau: Fioltrer à travers un tissu","Tratamento de agua: Filtra com pano","Water treatment: Strain it through a cloth","Water treatment: Strain it through a cloth","Water treatment: Strain it through a cloth","Water treatment: Strain it through a cloth","Water treatment: Strain it through a cloth","Water treatment: Strain it through a cloth","Water treatment: Strain it through a cloth","Traitement de l'eau: La filtrer a travers un tissu","Water treatment: Strain it through a cloth","Water treatment: Strain it through a cloth","Water treatment: Strain it through a cloth","Water treatment: Strain it through a cloth","Tratamento da água: Filtrar com um pano","Water treatment: Strain it through a cloth","Water treatment: Strain it through a cloth","Water treatment: Strain it through a cloth","Traitement de l'eau: La filtrer a travers un tissu","Water treatment: Strain it through a cloth","Water treatment: Strain it through a cloth","Tratamiento de agua: LA FILTRAN  O LA CUELAN CON UNA TELA"
"19","WQ15D","Water treatment: Use water filter","Day of recording test results","Traitement de l'eau: Utiliser un filtre à eau","Water treatment: Use water filter","Día del registro de la prueba de agua","Water treatment: Use water filter","Traitement de l'eau: UTILISER UN FILTRE A EAU (CERAMIQUE,SABLE, COMPOSITE, ETC.)","Water treatment: Use water filter","Traitement de l'eau : Utiliser un filtre à eau","Traitement de l'eau: Utiliser un filtre a eau (ceramique, sable, composite, etc.)","Traitement de l'eau: Utiliser un filtre à eau","Tratamento de agua: Usa filtro (Cerámica), Arreia e compósitos","Water treatment: Use water filter","Water treatment: Use water filter","Water treatment: Use water filter","Water treatment: Use water filter","Water treatment: Use water filter","Water treatment: Use water filter","Water treatment: Use water filter","Traitement de l'eau: Utiliser un filtre a eau (ceramique, sable, composite, etc.)","Water treatment: Use water filter","Water treatment: Use water filter","Water treatment: Use water filter","Water treatment: Use water filter","Tratamento de água: Usar um filtro de água","Water treatment: Use water filter","Water treatment: Use water filter","Water treatment: Use water filter","Traitement de l'eau: Utiliser un filtre a eau (ceramique, sable, composite, etc.)","Water treatment: Use water filter","Water treatment: Use water filter","Tratamiento de agua: UTILIZAN UN FILTRO DE AGUA COMO DE: CERÁMICA, ARENA, ETC"
