"20","WQ15E","Water treatment: Solar disinfection",NA,"Traitement de l'eau: Désinfection solaire","Water treatment: Solar disinfection",NA,"Water treatment: Solar disinfection","Traitement de l'eau: DESINFECTION SOLAIRE","Water treatment: Solar disinfection","Traitement de l'eau : Désinfection solaire","Traitement de l'eau: Desinfection solaire","Traitement de l'eau: Désinfection solaire","Tratamento de agua: Desinfeção solar","Water treatment: Solar disinfection","Water treatment: Solar disinfection","Water treatment: Solar disinfection","Water treatment: Solar disinfection","Water treatment: Solar disinfection","Water treatment: Solar disinfection","Water treatment: Solar disinfection","Traitement de l'eau: Desinfection solaire","Water treatment: Solar disinfection","Water treatment: Solar disinfection","Water treatment: Solar disinfection","Water treatment: Solar disinfection","Tratamento de água: Desinfecção Solar","Water treatment: Solar disinfection","Water treatment: Solar disinfection","Water treatment: Solar disinfection","Traitement de l'eau: Desinfection solaire","Water treatment: Solar disinfection","Water treatment: Solar disinfection",NA
"21","WQ4","Water treatment","Water treatment","Numéro de l'enquêteur/trice","Interviewer number","¿Ha hecho algo con el agua para que sea más segura para beber?","Interviewer number","Numéro du superviseur","Interviewer number","Numéro de l'enquêteur","Numéro du chef d'équipe","Numéro de l'enquêteur/trice","Número do supervisor","Supervisor's number","Supervisor's number","Supervisor's number","Interviewer number","Interviewer number","Interviewer's number","Interviewe number","Numéro du chef d'équipe","Supervisor's number","Interviewer's number","Supervisor's number","Supervisor's number","Número do supervisor","Supervisor's number","Interviewer number","Interviewer number","Numéro du chef d'équipe","Supervisor's number","Interviewer number","Nombre y código de la entrevistadora"
"22","WQ5A","Water treatment: Boil","Water treatment: Boil",NA,NA,"Tratamiento del agua: La hierve",NA,NA,"HH selected for household Arsenic testing",NA,NA,NA,NA,NA,NA,NA,NA,NA,NA,NA,NA,NA,NA,NA,NA,NA,NA,NA,NA,NA,NA,NA,NA
"23","WQ5B","Water treatment: Add bleach/chlorine","Water treatment: Add bleach/chlorine",NA,NA,"Tratamiento del agua: Le añade blanqueador/cloro/agente purificador",NA,NA,"HH selected for E.coli testing",NA,NA,NA,NA,NA,NA,NA,NA,NA,NA,NA,NA,NA,NA,NA,NA,NA,NA,NA,NA,NA,NA,NA,NA
"24","WQ5C","Water treatment: Strain it through a cloth","Water treatment: Strain it through a cloth",NA,NA,"Tratamiento del agua: La filtra con una tela",NA,NA,"HH selected for source Arsenic testing",NA,NA,NA,NA,NA,NA,NA,NA,NA,NA,NA,NA,NA,NA,NA,NA,NA,NA,NA,NA,NA,NA,NA,NA
"25","WQ5D","Water treatment: Use water filter","Water treatment: Use water filter","Jour de l'interview","Day of water quality test","Tratamiento del agua: Utiliza un filtro de agua(cerámica,arena,etc.)","Day of water quality test","Jour de l'interview","Day of water quality test","Jour de l'interview","Jour du test","Jour de l'interview","Dia do inquérito","Day of interview","Day of interview","Day of interview","Day of water quality test","Day of water quality test","Day of water testing","Day of water testing","Jour du test","Day of interview","Day of water quality test","Day of interview","Day of interview","Dia da entrevista","Day of interview","Day of interview","Day of water quality test","Jour du test","Day of interview","Day of water quality test","Día de la entrevista"
"26","WQ5E","Water treatment: Solar disinfection","Water treatment: Solar disinfection",NA,NA,"Tratamiento del agua: Desinfección solar",NA,NA,NA,NA,NA,NA,NA,NA,NA,NA,NA,NA,NA,NA,NA,NA,NA,NA,NA,NA,NA,NA,NA,NA,NA,NA,NA
"27","WS1","Main source of drinking water","Main source of drinking water","Source principale d'eau de boisson","Main source of drinking water","Fuente principal de agua para beber de los miembros de su hogar","Main source of drinking water","Quelle est la source principale d'eau que boivent les membres de votre ménage","Main source of drinking water","Principale source d'eau de boisson","Source principale d'eau de boisson","Source principale d'eau de boisson","De onde provém a água utilizada pelos membros do agregado principalmente para beber?","Main source of drinking water","Main source of drinking water","Main source of drinking water","Main source of drinking water","Main source of drinking water","Main source of drinking water","Main source of drinking water","Source principale d'eau de boisson","Main source of drinking water","Main source of drinking water","Main source of drinking water","Main source of drinking water","Principal fonte de água potável","Main source of drinking water","Main source of drinking water","Main source of drinking water","Source principale d'eau de boisson","Main source of drinking water","Main source of drinking water","¿Cuál es la fuente principal de agua para beber que utilizan los miembros de este hogar?"
"28","WS10A","Water treatment: Boil",NA,"Traitement de l'eau:  Bouillir","Water treatment: Boil",NA,"Water treatment: Boil","Que faites-vous habituellement à l'eau pour la rendre plus saine à boire: LA FAIRE BOUILLLIR","Water treatment: Boil","Traitement de l'eau : Bouillir","Traitement de l'eau: Bouillir","Traitement de l'eau:  Bouillir","A. Ferve-a","Water treatment: Boil","Water treatment: Boil","Water treatment: Boil","Water treatment: Boil","Water treatment: Boil","Water treatment: Boil","Water treatment: Boil","Traitement de l'eau: Bouillir",NA,"Water treatment: Boil","Water treatment: Boil","Water treatment: Boil","Tratamento de água: Ferver","Water treatment: Boil","Water treatment: Boil","Water treatment: Boil","Traitement de l'eau: Bouillir","Water treatment: Boil","Water treatment: Boil","Tratamiento de agua: LA HIERVEN"
"29","WS10B","Water treatment: Add bleach/chlorine",NA,"Traitement de l'eau: Ajouter de la Javel/Chlore","Water treatment: Add bleach/chlorine",NA,"Water treatment: Add bleach/chlorine","Que faites-vous habituellement à l'eau pour la rendre plus saine à boire:AJOUTER DE LA JAVEL/ CHLORE","Water treatment: Add bleach/chlorine","Traitement de l'eau : Ajouter de la javel/chlore","Traitement de l'eau: Ajouter de la javel/ chlore","Traitement de l'eau: Ajouter de la Javel/Chlore","B. Adiciona lixivia ou Pastilha de cloro","Water treatment: Add bleach/chlorine","Water treatment: Add bleach/chlorine","Water treatment: Add bleach/chlorine","Water treatment: Add bleach/chlorine","Water treatment: Add bleach/chlorine","Water treatment: Add bleach / chlorine","Water treatment: Add bleach/chlorine","Traitement de l'eau: Ajouter de la javel/ chlore",NA,"Water treatment: Add bleach/chlorine","Water treatment: Add bleach/chlorine","Water treatment: Add bleach/chlorine","Tratamento de água: adicionar lixivia / cloro","Water treatment: Add bleach/chlorine","Water treatment: Add bleach/chlorine","Water treatment: Add bleach/chlorine","Traitement de l'eau: Ajouter de la javel/ chlore","Water treatment: Add bleach/chlorine","Water treatment: Add bleach/chlorine","Tratamiento de agua: LE AÑADEN CLORO"
"30","WS10C","Water treatment: Strain it through a cloth",NA,"Traitement de l'eau: Filtrer à travers un tissu","Water treatment: Strain it through a cloth",NA,"Water treatment: Strain it through a cloth","Que faites-vous habituellement à l'eau pour la rendre plus saine à boire:FILTRER A TRAVERS UN TISSU","Water treatment: Strain it through a cloth","Traitement de l'eau : Filtrer à travers un tissu","Traitement de l'eau: Filtrer a travers un tissu","Traitement de l'eau: Filtrer à travers un tissu","C. Filtra com pano","Water treatment: Strain it through a cloth","Water treatment: Strain it through a cloth","Water treatment: Strain it through a cloth","Water treatment: Strain it through a cloth","Water treatment: Strain it through a cloth","Water treatment: Strain it through a cloth","Water treatment: Strain it through a cloth","Traitement de l'eau: Filtrer a travers un tissu",NA,"Water treatment: Strain it through a cloth","Water treatment: Strain it through a cloth","Water treatment: Strain it through a cloth","Tratamento da água: Filtrar com pano","Water treatment: Strain it through a cloth","Water treatment: Strain it through a cloth","Water treatment: Strain it through a cloth","Traitement de l'eau: Filtrer a travers un tissu","Water treatment: Strain it through a cloth","Water treatment: Strain it through a cloth","Tratamiento de agua: LA FILTRAN O LA CUELAN CON UNA TELA"
"31","WS10D","Water treatment: Use water filter",NA,"Traitement de l'eau: Utiliser un filtre à eau (céramique, sable, composite)","Water treatment: Use water filter",NA,"Water treatment: Use water filter","Que faites-vous habituellement à l'eau pour la rendre plus saine à boire:UTILISER UN FILTRE A EAU (CERAMIQUE, SABLE, COMPOSITE, ETC.)","Water treatment: Use water filter","Traitement de l'eau : Utiliser un filtre à eau","Traitement de l'eau: Utiliser un filtre a eau (ceramique, sable, composite, etc.)","Traitement de l'eau: Utiliser un filtre à eau (céramique, sable, composite)","D. Usa Filtro (cerâmica), areia e compositos","Water treatment: Use water filter","Water treatment: Use water filter","Water treatment: Use water filter","Water treatment: Use water filter","Water treatment: Use water filter","Water treatment: Use water filter","Water treatment: Use water filter","Traitement de l'eau: Utiliser un filtre a eau (ceramique, sable, composite, etc.)",NA,"Water treatment: Use water filter","Water treatment: Use water filter","Water treatment: Use water filter","Tratamento de água: Usar filtro de água","Water treatment: Use water filter","Water treatment: Use water filter","Water treatment: Use water filter","Traitement de l'eau: Utiliser un filtre a eau (ceramique, sable, composite, etc.)","Water treatment: Use water filter","Water treatment: Use water filter","Tratamiento de agua: UTILIZAN UN FILTRO PARA AGUA (CERÁMICA, ARENA, COMPUESTOS, ETC.)"
"32","WS10E","Water treatment: Solar disinfection",NA,"Traitement de l'eau: Désinfection solaire","Water treatment: Solar disinfection",NA,"Water treatment: Solar disinfection","Que faites-vous habituellement à l'eau pour la rendre plus saine à boire: DESINFECTION SOLAIRE","Water treatment: Solar disinfection","Traitement de l'eau : Désinfection solaire","Traitement de l'eau: Desinfection solaire","Traitement de l'eau: Désinfection solaire","E. Desinfecção Solar","Water treatment: Solar disinfection","Water treatment: Solar disinfection","Water treatment: Solar disinfection","Water treatment: Solar disinfection","Water treatment: Solar disinfection","Water treatment: Solar disinfection","Water treatment: Solar disinfection","Traitement de l'eau: Desinfection solaire",NA,"Water treatment: Solar disinfection","Water treatment: Solar disinfection","Water treatment: Solar disinfection","Tratamento de água: desinfecção Solar","Water treatment: Solar disinfection","Water treatment: Solar disinfection","Water treatment: Solar disinfection","Traitement de l'eau: Desinfection solaire","Water treatment: Solar disinfection","Water treatment: Solar disinfection",NA
"33","WS11","Type of toilet facility","Type of toilet facility","Type de topilettes utilisé par les membres de ménage","Type of toilet facility","Qué clase de instalación sanitaria utilizan por lo general los miembros de su hogar","Type of toilet facility","Quel type de toilettes les membres de ce ménage utilisent-ils habituellement","Type of toilet facility","Type de toilettes","Type de toilettes","Type de topilettes utilisé par les membres de ménage","Que tipo de casa de banho é utilizada pelos membros do agregado habitualmente?","Type of toilet facility","Type of toilet facility","Type of toilet facility","Type of toilet facility","Type of toilet facility","Type of toilet facility","Type of toilet facility","Type de toilettes","Type of toilet facility","Type of toilet facility","Type of toilet facility","Type of toilet facility","Tipo de instalação sanitária","Type of toilet facility","Type of toilet facility","Type of toilet facility","Type de toilettes","Type of toilet facility","Type of toilet facility","¿Qué tipo de servicio sanitario utilizan por lo general los miembros de este hogar?"
"34","WS12","Pit latrine or septic tank ever been emptied",NA,"Les fosses septiques ont déjà été vidées","Pit latrine or septic tank ever been emptied",NA,"Pit latrine or septic tank ever been emptied","Est-ce vos (réponse de ws11) ont déjà été vidées","Pit latrine or septic tank ever been emptied","Toilettes ont déjà été vidées","Les latrines ont déjà été vidées","Les fosses septiques ont déjà été vidées","A sua resposta (em WS11) foi alguma vez esvaziada?","Pit latrine or septic tank ever been emptied","Pit latrine or septic tank ever been emptied","Pit latrine or septic tank ever been emptied","Pit latrine or septic tank ever been emptied","Pit latrine or septic tank ever been emptied","Pit latrine or septic tank ever been emptied","Pit latrine or septic tank ever been emptied","Les latrines ont déjà été vidées","Pit latrine or septic tank ever been emptied","Pit latrine or septic tank ever been emptied","Pit latrine or septic tank ever been emptied","Pit latrine or septic tank ever been emptied","A latrina de fossa ou a fossa séptica já foram esvaziados","Pit latrine or septic tank ever been emptied","Pit latrine or septic tank ever been emptied","Pit latrine or septic tank ever been emptied","Les latrines ont déjà été vidées","Pit latrine or septic tank ever been emptied","Pit latrine or septic tank ever been emptied","Alguna vez, ¿Ha sido vaciado o limpiado el pozo séptico?"
"35","WS13","Place the contents were emptied",NA,"Lieu où le contenu des toilettes ont été mises","Place the contents were emptied",NA,"Place where the contents were emptied","La dernière fois que les toilettes ont été vidées où le contenu a-t-il été mis","Place the contents were emptied","Lieu de vidange du contenu des toilettes","Lieu où les latrines sont vidées","Lieu où le contenu des toilettes ont été mises","A ultima vez que as casas de banho foram esvaziadas a onde é que se deitou os produtos?","Place the contents were emptied","Place the contents were emptied","Place the contents were emptied","Place the contents were emptied","Place the contents were emptied","Place the contents were emptied","Place the contents were emptied to","Lieu où les latrines sont vidées","Place the contents were emptied","Place the contents were emptied","Place the contents were emptied","Place the contents were emptied","Onde foi depositado o residuo","Place the contents were emptied","Place the contents were emptied","Place the contents were emptied","Lieu où les latrines sont vidées","Place the contents were emptied","Place the contents were emptied","¿Dónde se eliminaron los desechos sólidos la última vez que fueron vaciados o limpiados?"
"36","WS14","Location of the toilet faciltity",NA,"L'emplacement/situation des toilettes","Location of the toilet faciltity",NA,"Location of the toilet faciltity","Où est-ce que vos toilettes sont situées","Location of the toilet faciltity","Emplacement des toilettes","Localisation des toilettes","L'emplacement/situation des toilettes","A onde é que se situa a vossa casa de banho?","Location of the toilet faciltity","Location of the toilet faciltity","Location of the toilet faciltity","Location of the toilet faciltity","Location of the toilet facility","Location of the toilet faciltity","Location of the toilet faciltity","Localisation des toilettes","Location of the toilet faciltity","Location of the toilet faciltity","Location of the toilet faciltity","Location of the toilet faciltity","Localização de instalação sanitaria","Location of the toilet faciltity","Location of the toilet faciltity","Location of the toilet faciltity","Localisation des toilettes","Location of the toilet faciltity","Location of the toilet faciltity","¿Dónde está situado el servicio sanitario de este hogar?"
"37","WS15","Toilet facility shared","Toilet facility shared","Toilettes partagées avec avec des personnes qui ne sont membres du ménage","Toilet facility shared","Comparte usted esta instalación con otras personas que no son miembros de su hogar","Toilet facility shared with other who are not members of your household","Partagez-vous ces toilettes avec des personnes qui ne sont pas membres de votre ménage","Toilet facility shared","Toilettes partagées","Toilettes partagées","Toilettes partagées avec avec des personnes qui ne sont membres du ménage","Esta instalação sanitária é compartilhada com outras pessoas que não fazem parte deste agregado?","Toilet facility shared","Toilet facility shared","Toilet facility shared","Toilet facility shared","Toilet facility shared","Toilet facility shared","Toilet facility shared","Toilettes partagées","Toilet facility shared","Toilet facility shared","Toilet facility shared","Toilet facility shared","Banheiro, instalação sanitaria compartilhada","Toilet facility shared","Toilet facility shared","Toilet facility shared","Toilettes partagées","ws15","Toilet facility shared","¿Comparte el hogar este servicio sanitario con otras personas que no son miembros de su hogar?"
"38","WS2","Main source of water used for other purposes (if bottled water used for drinking)","Main source of water used for other purposes (if bottled water used for drinking)","Priciopale source d'eau utilisée pour d'autres besoins (si l'eau de bouteille est utilisée pour boire)","Main source of water used for other purposes (if bottled water used for drinking)","Fuente principal de agua utilizada en su hogar  para otros fines tales como cocinar y lavarse las manos","Main source of water used for other purposes (if bottled water used for drinking)","Quelle est la source principale d'eau utilisée par les membres de ce ménage pour d'autres besoins","Main source of water used for other purposes (if bottled water used for drinking)","Principale source d'eau utilisée à d'autres fins (si l'eau en bouteille est utilisée pour boire)","Source de l'eau utilisée principalement pour les autres besoins (se laver, cuisiner, etc.)","Priciopale source d'eau utilisée pour d'autres besoins (si l'eau de bouteille est utilisée pour boire)","De onde provém a água utilizada pelos membros do agregado principalmente para outros fins, como cozinhar, lavar as mãos?","Main source of water used for other purposes (if bottled water used for drinking)","Main source of water used for other purposes (if bottled water used for drinking)","Main source of water used for other purposes (if bottled water used for drinking)","Main source of water used for other purposes (if bottled water used for drinking)","Main source of water used for other purposes (if bottled water used for drinking)","Main source of water used for other purposes (if bottled water used for drinking)","Main source of water used for other purposes (if bottled water used for drinking)","Source de l'eau utilisée principalement pour les autres besoins (se laver, cuisiner, etc.)","Main source of water used for other purposes (if bottled water used for drinking)","Main source of water used for other purposes (if bottled water used for drinking)","Main source of water used for other purposes (if bottled water used for drinking)","Main source of water used for other purposes (if bottled water used for drinking)","Principal fonte de água utilizada para outros fins (se água engarrafada usada para beber)","Main source of water used for other purposes (if bottled water used for drinking)","Main source of water used for other purposes (if bottled water used for drinking)","Main source of water used for other purposes (if bottled water used for drinking)","Source de l'eau utilisée principalement pour les autres besoins (se laver, cuisiner, etc.)","Main source of water used for other purposes (if bottled water used for drinking)","Main source of water used for other purposes (if bottled water used for drinking)","¿Cuál es la fuente principal de agua utilizada por los miembros de este hogar para otros fines, tales como cocinar y lavarse las manos?"
"39","WS9","Treat water to make safer for drinking",NA,"Quelque chose est faite à l'eau pour la rendre plus saine à boire","Treat water to make safer for drinking",NA,"Treat water to make safer for drinking","Faites-vous, ou n'importe quel autre membre de ce ménage, quelque chose à l'eau pour la rendre plus saine à boire","Treat water to make safer for drinking","Traiter l'eau pour la rendre plus saine à boire","Traite l'eau avant de la boire","Quelque chose est faite à l'eau pour la rendre plus saine à boire","Você ou outra pessoa do AF faz alguma coisa para tornar a água potável para beber?","Treat water to make safer for drinking","Treat water to make safer for drinking","Treat water to make safer for drinking","Treat water to make safer for drinking","Treat water to make safer for drinking","Treat water to make safer for drinking","Treat water to make safer for drinking","Traite l'eau avant de la boire",NA,"Treat water to make safer for drinking","Treat water to make safer for drinking","Treat water to make safer for drinking","Tratou a água para torná-la mais segura para beber","Treat water to make safer for drinking","Treat water to make safer for drinking","Treat water to make safer for drinking","Traite l'eau avant de la boire","Treat water to make safer for drinking","Treat water to make safer for drinking","¿Usted o algún miembro de este hogar le dan algún tratamiento al agua o le hace algo para hacerla más segura para beber?"
